{"schema_version":"0.2","tool":{"name":"scrub","version":"0.1.0"},"artifact":{"path":"controlled-u200b.txt","byte_length":50,"content_sha256":"e05cdd0954208eb7d75a47571940b2c82a1f3f6b73df7c0a922478a90fc58a83"},"findings":[{"mechanism":{"id":"unicode.bidi_control","version":"17.0.0"},"status":"absent","trace":{"observation":"unicode_property_membership","verifier":{"id":"scrub.unicode_property_scan","version":"17.0.0","availability":"available"},"authority":{"mechanism":"STANDARD","implementation":"PROJECT_IMPLEMENTATION","detector":"PROJECT_IMPLEMENTATION","source_ids":["unicode-proplist-17.0.0","unicode-uax44-17.0.0"],"related_reference":null},"configuration_identity":"unicode-17.0.0","supports":["unicode_property_absent_within_scope"],"does_not_support":["artifact_clean","human_authorship","ai_authorship","malicious_intent","watermark_present","watermark_absent"],"reproduce":{"command":["scrub","inspect","<artifact>","--json","--explain"]}},"evidence":[{"name":"locations","value":"[]"},{"name":"locations_truncated","value":"false"},{"name":"total_occurrence_count","value":"0"}],"limitations":["Bidi_Control presence is a neutral Unicode property observation; directional-formatting controls may have legitimate uses."],"assumptions":[]},{"mechanism":{"id":"unicode.default_ignorable_code_point","version":"17.0.0"},"status":"present","trace":{"observation":"unicode_property_membership","verifier":{"id":"scrub.unicode_property_scan","version":"17.0.0","availability":"available"},"authority":{"mechanism":"STANDARD","implementation":"PROJECT_IMPLEMENTATION","detector":"PROJECT_IMPLEMENTATION","source_ids":["unicode-derived-core-properties-17.0.0","unicode-uax44-17.0.0"],"related_reference":null},"configuration_identity":"unicode-17.0.0","supports":["unicode_property_present"],"does_not_support":["artifact_clean","human_authorship","ai_authorship","malicious_intent","watermark_present","watermark_absent"],"reproduce":{"command":["scrub","inspect","<artifact>","--json","--explain"]}},"evidence":[{"name":"locations","value":"[{\"code_point\":\"U+200B\",\"byte_offset\":4,\"scalar_offset\":4}]"},{"name":"locations_truncated","value":"false"},{"name":"total_occurrence_count","value":"1"}],"limitations":["Default_Ignorable_Code_Point presence is a neutral Unicode property observation; values may have legitimate formatting, shaping, language, or emoji uses."],"assumptions":[]},{"mechanism":{"id":"unicode.normalization.nfc_difference","version":"17.0.0"},"status":"absent","trace":{"observation":"unicode_normalization_difference","verifier":{"id":"unicode-normalization","version":"0.1.25","availability":"available"},"authority":{"mechanism":"STANDARD","implementation":"PUBLIC_REFERENCE","detector":"PUBLIC_REFERENCE","source_ids":["unicode-normalization-crate-0.1.25","unicode-normalization-test-17.0.0","unicode-uax15-17.0.0"],"related_reference":null},"configuration_identity":"unicode-17.0.0","supports":["unicode_normalization_difference_absent_within_scope"],"does_not_support":["artifact_clean","human_authorship","ai_authorship","malicious_intent","watermark_present","watermark_absent"],"reproduce":{"command":["scrub","inspect","<artifact>","--json","--explain"]}},"evidence":[],"limitations":["An NFC difference is a neutral Unicode normalization observation; it does not establish security risk, provenance, authorship, intent, or watermark presence."],"assumptions":[]},{"mechanism":{"id":"unicode.normalization.nfkc_difference","version":"17.0.0"},"status":"absent","trace":{"observation":"unicode_normalization_difference","verifier":{"id":"unicode-normalization","version":"0.1.25","availability":"available"},"authority":{"mechanism":"STANDARD","implementation":"PUBLIC_REFERENCE","detector":"PUBLIC_REFERENCE","source_ids":["unicode-normalization-crate-0.1.25","unicode-normalization-test-17.0.0","unicode-uax15-17.0.0"],"related_reference":null},"configuration_identity":"unicode-17.0.0","supports":["unicode_normalization_difference_absent_within_scope"],"does_not_support":["artifact_clean","human_authorship","ai_authorship","malicious_intent","watermark_present","watermark_absent"],"reproduce":{"command":["scrub","inspect","<artifact>","--json","--explain"]}},"evidence":[],"limitations":["An NFKC difference is a neutral Unicode compatibility-normalization observation; compatibility folding can erase distinctions and must not be interpreted as sanitization, security risk, provenance, authorship, intent, or watermark presence."],"assumptions":[]},{"mechanism":{"id":"c2pa.text_manifest_wrapper","version":"2.4"},"status":"absent","trace":{"observation":"c2pa_text_manifest_wrapper","verifier":{"id":"scrub.c2pa_text_wrapper","version":"2.4","availability":"available"},"authority":{"mechanism":"STANDARD","implementation":"PROJECT_IMPLEMENTATION","detector":"PROJECT_IMPLEMENTATION","source_ids":["c2pa-spec-2.4"],"related_reference":null},"configuration_identity":"c2pa-2.4-a8","supports":["c2pa_carrier_absent_within_scope"],"does_not_support":["artifact_clean","human_authorship","ai_authorship","watermark_present","watermark_absent","c2pa_claim_validity","c2pa_hard_binding","c2pa_credential_trust","authorship","truthfulness"],"reproduce":{"command":["scrub","inspect","<artifact>","--json","--explain"]}},"evidence":[],"limitations":["C2PA 2.4 Appendix A.8 remains under review and may change; this carrier is distinct from Claude embedded text watermarking."],"assumptions":[]},{"mechanism":{"id":"c2pa.manifest_store","version":"2.4"},"status":"not_applicable","trace":{"observation":"c2pa_manifest_store","verifier":{"id":"c2pa-rs","version":"0.90.12","availability":"available"},"authority":{"mechanism":"STANDARD","implementation":"PUBLIC_REFERENCE","detector":"PUBLIC_REFERENCE","source_ids":["c2pa-rs","c2pa-spec-2.4"],"related_reference":null},"configuration_identity":"c2pa-rs-0.90.12-fixed-local-settings","supports":[],"does_not_support":["artifact_clean","human_authorship","ai_authorship","watermark_present","watermark_absent","c2pa_claim_validity","c2pa_hard_binding","c2pa_credential_trust","authorship","truthfulness"],"reproduce":{"command":["scrub","inspect","<artifact>","--json","--explain"]}},"evidence":[],"limitations":[],"assumptions":[]},{"mechanism":{"id":"c2pa.manifest_validation","version":"2.4"},"status":"not_applicable","trace":{"observation":"c2pa_manifest_validation","verifier":{"id":"c2pa-rs","version":"0.90.12","availability":"available"},"authority":{"mechanism":"STANDARD","implementation":"PUBLIC_REFERENCE","detector":"PUBLIC_REFERENCE","source_ids":["c2pa-rs","c2pa-spec-2.4"],"related_reference":null},"configuration_identity":"c2pa-rs-0.90.12-fixed-local-settings","supports":[],"does_not_support":["artifact_clean","human_authorship","ai_authorship","watermark_present","watermark_absent","c2pa_hard_binding","c2pa_credential_trust","authorship","truthfulness"],"reproduce":{"command":["scrub","inspect","<artifact>","--json","--explain"]}},"evidence":[],"limitations":[],"assumptions":[]},{"mechanism":{"id":"c2pa.hard_binding","version":"2.4"},"status":"not_applicable","trace":{"observation":"c2pa_hard_binding","verifier":{"id":"c2pa-rs","version":"0.90.12","availability":"available"},"authority":{"mechanism":"STANDARD","implementation":"PUBLIC_REFERENCE","detector":"PUBLIC_REFERENCE","source_ids":["c2pa-rs","c2pa-spec-2.4"],"related_reference":null},"configuration_identity":"c2pa-rs-0.90.12-fixed-local-settings","supports":[],"does_not_support":["artifact_clean","human_authorship","ai_authorship","watermark_present","watermark_absent","c2pa_credential_trust","authorship","truthfulness"],"reproduce":{"command":["scrub","inspect","<artifact>","--json","--explain"]}},"evidence":[],"limitations":[],"assumptions":[]},{"mechanism":{"id":"c2pa.credential_trust","version":"2.4"},"status":"not_applicable","trace":{"observation":"c2pa_credential_trust","verifier":{"id":"c2pa-rs","version":"0.90.12","availability":"available"},"authority":{"mechanism":"STANDARD","implementation":"PUBLIC_REFERENCE","detector":"PUBLIC_REFERENCE","source_ids":["c2pa-rs","c2pa-spec-2.4"],"related_reference":null},"configuration_identity":"c2pa-rs-0.90.12-fixed-local-settings","supports":[],"does_not_support":["artifact_clean","human_authorship","ai_authorship","watermark_present","watermark_absent","authorship","truthfulness"],"reproduce":{"command":["scrub","inspect","<artifact>","--json","--explain"]}},"evidence":[],"limitations":[],"assumptions":[]},{"mechanism":{"id":"anthropic.embedded_text_watermark","version":"provider documentation published 2026-08-14; exact deployment undisclosed"},"status":"unknown","trace":{"observation":"provider_text_watermark","verifier":{"id":"anthropic.provider_detector","version":"unpublished","availability":"unavailable"},"authority":{"mechanism":"PUBLIC_MECHANISM_PRIVATE_KEY","implementation":"UNDOCUMENTED_PROVIDER","detector":"UNDOCUMENTED_PROVIDER","source_ids":["anthropic-claude-marking","anthropic-claude-text-watermark"],"related_reference":{"mechanism_id":"reference.synthid_text","relationship":"related_family_not_deployment_parity"}},"configuration_identity":null,"supports":["provider_mechanism_family_disclosed","provider_detector_unavailable"],"does_not_support":["artifact_clean","human_authorship","ai_authorship","watermark_present","watermark_absent","claude_watermark_present","claude_watermark_absent","claude_provider_parity"],"reproduce":{"command":["scrub","inspect","<artifact>","--json","--explain"]}},"evidence":[{"name":"detector_availability","value":"announced_forthcoming"},{"name":"exact_deployed_configuration","value":"undisclosed"},{"name":"provider_detector_api_contract","value":"unknown_not_public"},{"name":"provider_key","value":"private_not_public"},{"name":"public_reference_relationship","value":"related_family_not_deployment_parity"}],"limitations":["A public SynthID reference result is not an Anthropic provider-detector result; UNKNOWN does not mean human-written or unwatermarked.","The checked